No,Komentar,Sumber,Pakar 1,Pakar 2,Pakar 3,Pakar 4,Positif,Negatif,Hasil Akhir
166,"Ada hal yang aku suka dari MRT, yaitu ketika naik kereta MRT berdiri. Meski dengan posisi berdiri dan tanpa berpegangan, getaran dan guncangan saat kereta melaju itu hampir gak terasa, akselerasi dan pengeremannya pun juga halus, jadi gak khawatir tiba2 terpental. Kalau menilik teknologi infrastrukturnya sendiri udah sejajar sama Kereta HSR Shinkansen yang Bantalan Rel-nya pakai cor beton / Slab Track, jadi lebih rata dan sejajar. Kata bos aku, MRT bikin ketagihan pengen naik terus... ??",Instagram,Positif,Positif,Positif,Positif,4,0,Positif
167,"Tadinya gw bawa motor, atau kadang mbl. Tp sejak ada MRT dan untungnya kantor gw bisa diakses MRT. Gw jd sering naik MRT, dan Transjakarta. Kadang juga bawa sepeda, nyaman bgt bawa sepeda ke MRT.",Instagram,Positif,Positif,Positif,Positif,4,0,Positif
168,"Gara2 ketagihan naik MRT, jadi mikir pengen move on ke daerah sekitaran cipete, biar tiap hari kalo berangkat dan pulang kerja naik MRT terus ??",Instagram,Positif,Positif,Positif,Positif,4,0,Positif
251,"Trotoar dari Park & Ride dikasih atap juga dong kalo bisa. Hujan gmn tuh tar? Jangan yg dari poins square aja yg dikasih atap. Jauh loh itu, 500m ada kali.",Twitter,Negatif,Negatif,Negatif,Negatif,0,4,Negatif
252,"gak usah dihimbau-himbau, kalau memang ada aturannya dilarang dan didenda aja. penegakan peraturan harus pakai bahasa yg tegas. bahasa yg lembek sama juga artinya lembek dalam penegakan peraturan.",Twitter,Negatif,Negatif,Negatif,Negatif,0,4,Negatif
256,"Sistem yg sangat aneh. Masak turun dr halte busway HI, lanjut MRT kartu flazz nya gak bisa dipake di MRT dgn alasan yg sama. Pdhal kan pas mau msk sta MRT nya itu kita nge-tap keluar dr halte busway hitungannya. Ttp aja dianggap sdh nge-tap di stasiun yg sama. Fix this please!",Twitter,Negatif,Negatif,Negatif,Negatif,0,4,Negatif
