No,Komentar,Sumber,Pakar 1,Pakar 2,Pakar 3,Pakar 4,Positif,Negatif,Hasil Akhir
144,"sesuai dengan harganya, sangat memuaskan. pertahankan pelayanannya di segala bagian. MANTAP",Facebook,Positif,Positif,Positif,Positif,4,0,Positif
149,"Terimakasih untuk manajemen MRT, kemarin termos kesayangan Saya ketinggalan di toilet MRT Dukuh Atas ..... 2 jam kemudian Saya cari.... tanya ke security, ternyata masih ada ",Twitter,Positif,Positif,Positif,Positif,4,0,Positif
152,Seneng aku ada MRT. Jadi makin cepet sampe kantor dan balim kerumah. Masukan aja untuk mesing single trip nya mohon di banahi. Agar berfungsi dengan baik.,Twitter,Positif,Positif,Positif,Positif,4,0,Positif
230,"@mrtjakarta pagi, tolong di benerin yaa, dukuh atas BNI arah... Thx",Twitter,Negatif,Negatif,Negatif,Negatif,0,4,Negatif
232,"Halo @mrtjakarta mohon penjelasannya!  Emoney saya dianggap tdk tap keluar dr st istora tgl 27 sep, pdhl saya tap di gate dan bs keluar dr stasiun. Trs dikenakan cas 14rb.  Ini bukan kesalahan saya, tp sistem gate mrt, harusnya saya tdk disuruh bayar.  Thx.",Twitter,Negatif,Negatif,Negatif,Negatif,0,4,Negatif
233,"Emg mesin tap mrt jakarta bapuk bgt, udahlah bacanya lama, bikin ngantri sering error pula ??",Twitter,Negatif,Negatif,Negatif,Negatif,0,4,Negatif
